{
  "schemaVersion": 1,
  "catalogId": "reapp-hackathon-starters-v1",
  "constraints": {
    "network": "stellar-testnet",
    "paidMethod": "GET",
    "proofPolicy": "bound-v2-only",
    "runtime": "local-consumer-and-fulfillment",
    "fixturePolicy": "deterministic-and-clearly-labeled",
    "compatibilityClaim": "reapp-bound-v2"
  },
  "sources": {
    "cloudflare-x402": {
      "title": "Cloudflare x402 launch",
      "url": "https://blog.cloudflare.com/x402/"
    },
    "cloudflare-gateway": {
      "title": "Cloudflare Monetization Gateway",
      "url": "https://blog.cloudflare.com/monetization-gateway/"
    },
    "cloudflare-http": {
      "title": "Cloudflare charge for HTTP content",
      "url": "https://developers.cloudflare.com/agents/tools/payments/x402/charge-for-http-content/"
    },
    "cloudflare-mcp": {
      "title": "Cloudflare charge for MCP tools",
      "url": "https://developers.cloudflare.com/agents/tools/payments/x402/charge-for-mcp-tools/"
    },
    "cloudflare-agents": {
      "title": "Cloudflare pay from Agents SDK",
      "url": "https://developers.cloudflare.com/agents/tools/payments/x402/pay-from-agents-sdk/"
    },
    "cloudflare-coding": {
      "title": "Cloudflare pay from coding tools",
      "url": "https://developers.cloudflare.com/agents/tools/payments/x402/pay-with-tool-plugins/"
    },
    "coinbase-x402": {
      "title": "Coinbase x402 overview",
      "url": "https://docs.cdp.coinbase.com/x402/welcome"
    },
    "coinbase-bazaar": {
      "title": "Coinbase x402 Bazaar",
      "url": "https://docs.cdp.coinbase.com/x402/bazaar"
    },
    "x402-foundation": {
      "title": "x402 Foundation repository",
      "url": "https://github.com/x402-foundation/x402"
    },
    "coinbase-agent-winners": {
      "title": "Coinbase Agents in Action winners",
      "url": "https://www.coinbase.com/en-sg/developer-platform/discover/launches/agents-in-action-winners"
    },
    "coinbase-code-winners": {
      "title": "Coinbase Code NYC recap",
      "url": "https://www.coinbase.com/developer-platform/discover/launches/code-nyc-recap"
    },
    "stellar-agentic-results": {
      "title": "Stellar Q1 2026 agentic-payments results",
      "url": "https://stellar.org/blog/foundation-news/q1-2026-execution-at-network-scale"
    },
    "stellar-developer-meetings": {
      "title": "Stellar developer meetings",
      "url": "https://developers.stellar.org/meetings"
    },
    "stellar-i3": {
      "title": "Stellar i3 Awards 2025",
      "url": "https://stellar.org/blog/ecosystem/stellar-i-awards-2025"
    },
    "stellar-better": {
      "title": "Better on Stellar results",
      "url": "https://stellar.org/blog/foundation-news/better-on-stellar-challenge-from-what-if-to-what-now"
    }
  },
  "kits": [
    {
      "id": "research-source-scout",
      "slug": "research-source-scout",
      "title": "Research Source Scout",
      "category": "Data APIs",
      "difficulty": "Beginner",
      "summary": "A research agent buys ranked market, academic, and news sources, then stops when its mandate cannot fund a fourth source.",
      "paidResource": "GET /source/:sourceId",
      "businessLogic": "Rank sources by relevance, purchase the three planned sources sequentially, retain per-source provenance and evidence, and record the rejected fourth source without creating a paid delivery.",
      "features": ["verified-bound-purchase", "cumulative-budget", "request-binding", "independent-verification", "explorer-evidence"],
      "negativePath": {
        "id": "budget-exhausted",
        "outcome": "The fourth purchase is rejected on-chain because its exact amount exceeds the mandate's remaining authority."
      },
      "fixtures": "Four stable JSON sources with fixed identifiers, prices, relevance scores, and per-source provenance.",
      "inspiration": ["coinbase-x402", "cloudflare-x402", "coinbase-agent-winners"]
    },
    {
      "id": "page-snapshot-meter",
      "slug": "page-snapshot-meter",
      "title": "Page Snapshot Meter",
      "category": "Content infrastructure",
      "difficulty": "Intermediate",
      "summary": "An agent buys a normalized page snapshot containing metadata, links, word count, and a content hash.",
      "paidResource": "GET /snapshots/:pageId",
      "businessLogic": "Reject fixture HTML containing script, style, or iframe elements, extract text metadata, and hash the normalized result; this is not a general HTML sanitizer.",
      "features": ["verified-bound-purchase", "request-binding", "response-integrity", "explorer-evidence"],
      "negativePath": {
        "id": "snapshot-resource-rebinding",
        "outcome": "Payment for one page cannot unlock a different page because the proof is bound to the exact requested resource."
      },
      "fixtures": "Two bundled HTML fixture pages and one deterministic normalization check covering title, links, and word count; the live result computes a content hash, and the kit makes no browser-rendering claim.",
      "inspiration": ["cloudflare-x402", "cloudflare-http"]
    },
    {
      "id": "api-tollgate",
      "slug": "api-tollgate",
      "title": "Existing API Tollgate",
      "category": "Infrastructure",
      "difficulty": "Beginner",
      "summary": "Demonstrate an allowlisted fixture-gateway pattern for a read-only API boundary.",
      "paidResource": "GET /gateway/:service/:resourceId",
      "businessLogic": "Resolve only allowlisted bundled inventory and weather fixtures and return provenance with no forwarded headers; add real header filtering and timeouts before connecting a live backend.",
      "features": ["merchant-scope", "independent-verification", "request-binding", "explorer-evidence"],
      "negativePath": {
        "id": "upstream-not-allowlisted",
        "outcome": "An upstream route outside the explicit allowlist is rejected before a payment challenge is issued."
      },
      "fixtures": "Two bundled inventory and weather route fixtures with stable payloads and explicit route mappings; no live upstream is called.",
      "inspiration": ["cloudflare-gateway", "cloudflare-http"]
    },
    {
      "id": "paid-tool-gateway",
      "slug": "paid-tool-gateway",
      "title": "Paid Tool Gateway",
      "category": "Agent tooling",
      "difficulty": "Intermediate",
      "summary": "Publish free schema-described tool discovery while charging for selected tool results through a bounded HTTP integration.",
      "paidResource": "GET /tools/:toolId/results/:fixtureId",
      "businessLogic": "Publish free discovery metadata for two fixture tools, require a known fixture identifier, enforce the price ceiling in an offline consumer-policy check, and return result provenance from the fixed live purchase.",
      "features": ["price-inspection", "verified-bound-purchase", "fixture-selection", "request-binding"],
      "negativePath": {
        "id": "tool-price-ceiling",
        "outcome": "The offline consumer-policy check rejects a quoted tool price above its declared ceiling before any payment attempt."
      },
      "fixtures": "Two deterministic supply-risk and document-classification tools with declared fixtureId schemas and fixed outputs.",
      "inspiration": ["cloudflare-mcp", "cloudflare-agents", "x402-foundation"]
    },
    {
      "id": "coding-agent-purchase-hook",
      "slug": "coding-agent-purchase-hook",
      "title": "Coding Agent Purchase Hook",
      "category": "Developer tooling",
      "difficulty": "Intermediate",
      "summary": "The shared live consumer verifies the fixed price, settles once, retries the paid request once, and verifies the returned patch hash; an offline hook vector rejects a repeated 402 in the settled state.",
      "paidResource": "GET /artifacts/:issueId/patch",
      "businessLogic": "Serve a patch only for the allowlisted fixture host, verify its hash after delivery, and return atomic-write metadata without writing files; the repeated-402 hook check is an offline state-transition vector.",
      "features": ["verified-bound-purchase", "price-inspection", "durable-recovery", "explorer-evidence"],
      "negativePath": {
        "id": "repeated-payment-challenge",
        "outcome": "The offline hook transition rejects a repeated 402 in the settled state instead of initiating another payment."
      },
      "fixtures": "Two issue identifiers with deterministic patch artifacts and computed SHA-256 values.",
      "inspiration": ["cloudflare-coding", "cloudflare-agents", "coinbase-code-winners"]
    },
    {
      "id": "service-bazaar",
      "slug": "service-bazaar",
      "title": "Discoverable Service Bazaar",
      "category": "Discovery",
      "difficulty": "Advanced",
      "summary": "Offline vectors rank bundled service-listing fixtures; the live plan buys the fixed alpha merchant route.",
      "paidResource": "GET /services/:serviceId/results/:fixtureId",
      "businessLogic": "Offline vectors rank listings by schema, price, quality, and latency; the live route accepts only the fixed merchant label and known fixture.",
      "features": ["price-inspection", "merchant-scope", "request-binding", "independent-verification"],
      "negativePath": {
        "id": "listing-merchant-mismatch",
        "outcome": "A wrong-merchant listing is excluded even though its declared price, quality, and latency signals would otherwise rank first."
      },
      "fixtures": "Three unsigned catalog fixtures with stable schemas, prices, quality signals, merchant labels, and outputs.",
      "inspiration": ["coinbase-bazaar", "x402-foundation"]
    },
    {
      "id": "agent-reputation-snapshot",
      "slug": "agent-reputation-snapshot",
      "title": "Agent Reputation Snapshot",
      "category": "Identity",
      "difficulty": "Advanced",
      "summary": "Buy a time-bounded reputation snapshot derived from signed execution events without treating a score as payment authority.",